{
  "$schema": "../authoring/schemas/knowledge-catalog.schema.json",
  "schemaVersion": 2,
  "vocabularies": {
    "applicabilityTags": [
      { "id": "accessibility", "label": "Accessibility-sensitive interfaces" },
      { "id": "cargo", "label": "Cargo-managed projects" },
      { "id": "cli", "label": "Command-line products" },
      { "id": "general", "label": "Technology-neutral validation decisions" },
      { "id": "generated-assets", "label": "Generated and projected assets" },
      { "id": "git", "label": "Git work trees" },
      { "id": "javascript", "label": "JavaScript source and artifacts" },
      { "id": "nodejs", "label": "Node.js runtime" },
      { "id": "pnpm", "label": "pnpm-managed projects" },
      { "id": "release", "label": "Release and distribution validation" },
      { "id": "rust", "label": "Rust source and toolchains" },
      { "id": "typescript", "label": "TypeScript source and compiler projects" },
      { "id": "web", "label": "Web content and interfaces" }
    ],
    "evidenceDimensions": [
      { "id": "accessibility", "label": "Accessibility" },
      { "id": "build-package", "label": "Build, package, installation, and artifact inspection" },
      { "id": "contract-testing", "label": "Contract testing" },
      { "id": "end-to-end-testing", "label": "End-to-end testing" },
      { "id": "formatting-linting", "label": "Formatting and linting" },
      { "id": "generative-testing", "label": "Property-based, fuzz, and mutation testing" },
      { "id": "integration-testing", "label": "Component and integration testing" },
      { "id": "performance", "label": "Performance and load" },
      { "id": "persistence-schema-generated", "label": "Persistence, schema, and generated-output validation" },
      { "id": "platform-runtime", "label": "Platform and runtime support" },
      { "id": "repository-reproducibility", "label": "Repository consistency and reproducibility" },
      { "id": "smoke-testing", "label": "Smoke testing" },
      { "id": "static-analysis", "label": "Type and static analysis" },
      { "id": "strategy", "label": "Evidence reasoning and strategy" },
      { "id": "supply-chain", "label": "Dependency, license, and supply-chain security" },
      { "id": "unit-testing", "label": "Unit testing" }
    ]
  },
  "navigation": [
    "README.md",
    "SOURCES.md",
    "explanations/README.md",
    "explanations/concerns/README.md",
    "explanations/foundations/README.md",
    "explanations/frameworks/README.md",
    "explanations/languages/README.md",
    "explanations/patterns/README.md",
    "explanations/technologies/README.md",
    "how-to/README.md",
    "how-to/recipes/README.md",
    "reference/README.md",
    "reference/standards/README.md",
    "reference/tools/README.md"
  ],
  "documents": [
    {
      "id": "concern.reproducible-release-evidence",
      "title": "Reproducible Release Evidence",
      "kind": "concern",
      "path": "explanations/concerns/reproducible-release-evidence.md",
      "summary": "Selects ecosystem-neutral evidence for controlled inputs, generated assets, complete artifacts, and repeatable releases.",
      "questions": ["What evidence supports repeatable and complete source-to-artifact releases?"],
      "applicability": ["general", "generated-assets", "release"],
      "evidenceDimensions": ["build-package", "repository-reproducibility", "supply-chain"],
      "related": ["pattern.isolation-and-determinism", "recipe.javascript-typescript-package-gate", "recipe.rust-cli-release-gate"],
      "sources": ["reproducible-builds.definition"],
      "status": "reviewed",
      "lastReviewed": "2026-10-01"
    },
    {
      "id": "foundation.evidence-quality",
      "title": "Evidence Quality",
      "kind": "foundation",
      "path": "explanations/foundations/evidence-quality.md",
      "summary": "Explains when observations support bounded claims and how flakiness and oracle error weaken evidence.",
      "questions": ["When does an executed check meaningfully support a claim?"],
      "applicability": ["general"],
      "evidenceDimensions": ["strategy"],
      "related": ["pattern.evidence-chain", "pattern.isolation-and-determinism", "pattern.oracles-and-failure-paths"],
      "sources": ["google.flaky-tests", "nist.ssdf-1.1"],
      "status": "reviewed",
      "lastReviewed": "2026-10-01"
    },
    {
      "id": "foundation.source-policy",
      "title": "Source Policy",
      "kind": "foundation",
      "path": "explanations/foundations/source-policy.md",
      "summary": "Defines authority, traceability, synthesis, offline usefulness, and explicit handling of missing coverage.",
      "questions": ["How should local guidance use and cite external knowledge?"],
      "applicability": ["general"],
      "evidenceDimensions": ["strategy"],
      "related": ["foundation.validation-strategy"],
      "sources": ["json-schema.2020-12"],
      "status": "reviewed",
      "lastReviewed": "2026-10-01"
    },
    {
      "id": "foundation.test-types",
      "title": "Test Types",
      "kind": "foundation",
      "path": "explanations/foundations/test-types.md",
      "summary": "Distinguishes unit, component, integration, contract, end-to-end, and smoke tests by concrete boundary.",
      "questions": ["Which test boundary can observe the relevant failure?"],
      "applicability": ["general"],
      "evidenceDimensions": ["contract-testing", "end-to-end-testing", "integration-testing", "smoke-testing", "unit-testing"],
      "related": ["foundation.validation-model", "pattern.oracles-and-failure-paths"],
      "sources": ["ieee.swebok-v4"],
      "status": "reviewed",
      "lastReviewed": "2026-10-01"
    },
    {
      "id": "foundation.validation-model",
      "title": "Validation Model",
      "kind": "foundation",
      "path": "explanations/foundations/validation-model.md",
      "summary": "Maps independent evidence dimensions to the questions and limitations each can address.",
      "questions": ["What evidence dimensions may be relevant and what can each establish?"],
      "applicability": ["general"],
      "evidenceDimensions": ["accessibility", "build-package", "contract-testing", "end-to-end-testing", "formatting-linting", "generative-testing", "integration-testing", "performance", "persistence-schema-generated", "platform-runtime", "repository-reproducibility", "smoke-testing", "static-analysis", "strategy", "supply-chain", "unit-testing"],
      "related": ["foundation.test-types", "foundation.validation-strategy", "pattern.evidence-chain"],
      "sources": ["nist.ssdf-1.1"],
      "status": "reviewed",
      "lastReviewed": "2026-10-01"
    },
    {
      "id": "foundation.validation-strategy",
      "title": "Validation Strategy",
      "kind": "foundation",
      "path": "explanations/foundations/validation-strategy.md",
      "summary": "Provides a consequence-first process for selecting proportional evidence, placement, tools, and residual risk.",
      "questions": ["How should a contextual validation strategy be selected?"],
      "applicability": ["general"],
      "evidenceDimensions": ["strategy"],
      "related": ["foundation.validation-model", "pattern.evidence-chain", "standard.wcag-2.2"],
      "sources": ["nist.ssdf-1.1", "w3c.wcag-2.2"],
      "status": "reviewed",
      "lastReviewed": "2026-10-01"
    },
    {
      "id": "language.javascript",
      "title": "JavaScript Validation",
      "kind": "language",
      "path": "explanations/languages/javascript.md",
      "summary": "Bounds JavaScript language evidence separately from host runtimes, typed source, frameworks, and build tools.",
      "questions": ["Which language-level evidence is relevant for authored or emitted JavaScript?"],
      "applicability": ["javascript"],
      "evidenceDimensions": ["integration-testing", "platform-runtime", "unit-testing"],
      "related": ["language.typescript", "technology.nodejs", "tool.vitest"],
      "sources": ["ecma.ecmascript-2025"],
      "status": "reviewed",
      "lastReviewed": "2026-10-01"
    },
    {
      "id": "language.rust",
      "title": "Rust Validation",
      "kind": "language",
      "path": "explanations/languages/rust.md",
      "summary": "Connects Cargo-era Rust failure modes to compilation, tests, lint, MSRV, and package evidence.",
      "questions": ["Which language-specific evidence supports a maintained Rust crate?"],
      "applicability": ["cargo", "rust"],
      "evidenceDimensions": ["build-package", "formatting-linting", "platform-runtime", "static-analysis", "unit-testing"],
      "related": ["recipe.rust-cli-release-gate", "tool.cargo", "tool.clippy", "tool.rustfmt"],
      "sources": ["rust.cargo"],
      "status": "reviewed",
      "lastReviewed": "2026-10-01"
    },
    {
      "id": "language.typescript",
      "title": "TypeScript Validation",
      "kind": "language",
      "path": "explanations/languages/typescript.md",
      "summary": "Explains TypeScript project/type evidence and its boundary from emitted JavaScript and runtime behavior.",
      "questions": ["What additional evidence is useful for JavaScript authored through TypeScript?"],
      "applicability": ["javascript", "typescript"],
      "evidenceDimensions": ["build-package", "static-analysis"],
      "related": ["language.javascript", "tool.typescript-compiler", "tool.vitest"],
      "sources": ["typescript.docs-6"],
      "status": "reviewed",
      "lastReviewed": "2026-10-01"
    },
    {
      "id": "pattern.evidence-chain",
      "title": "Evidence Chain",
      "kind": "pattern",
      "path": "explanations/patterns/evidence-chain.md",
      "summary": "Connects consequences and invariants to bounded claims, failure modes, observations, mechanisms, and limits.",
      "questions": ["Why does this mechanism provide relevant evidence for this claim?"],
      "applicability": ["general"],
      "evidenceDimensions": ["strategy"],